{
  "schema_version": "0.3",
  "reviewed_at": "2026-06-02",
  "categories": [
    {
      "id": "industrial-manipulators",
      "name": "Industrial Manipulators",
      "description": "Robot-arm drivers, controller bridges, and ros2_control integrations for industrial and collaborative manipulators."
    },
    {
      "id": "mobile-bases-and-robots",
      "name": "Mobile Bases And Robots",
      "description": "Drivers and platform package stacks for mobile robots and base platforms."
    },
    {
      "id": "cameras-and-rgb-d",
      "name": "Cameras And RGB-D",
      "description": "Camera, RGB-D, and image pipeline packages used for perception bringup."
    },
    {
      "id": "lidar",
      "name": "LiDAR",
      "description": "2D and 3D LiDAR drivers and sensor wrappers."
    },
    {
      "id": "imu-and-positioning",
      "name": "IMU And Positioning",
      "description": "IMU, GNSS, inertial, and positioning sensor drivers used in robot state estimation."
    },
    {
      "id": "grippers-and-end-effectors",
      "name": "Grippers And End Effectors",
      "description": "Drivers for grippers, end effectors, and related actuator interfaces."
    },
    {
      "id": "actuators-and-motor-controllers",
      "name": "Actuators And Motor Controllers",
      "description": "Actuator SDKs, smart-servo interfaces, and motor-controller packages used in ROS 2 hardware bringup."
    },
    {
      "id": "control-and-hardware-interfaces",
      "name": "Control And Hardware Interfaces",
      "description": "Core ROS 2 control frameworks, controllers, and generic hardware-interface packages."
    }
  ],
  "entries": [
    {
      "name": "Universal Robots ROS 2 Driver",
      "repo": "UniversalRobots/Universal_Robots_ROS2_Driver",
      "url": "https://github.com/UniversalRobots/Universal_Robots_ROS2_Driver",
      "category": "industrial-manipulators",
      "description": "Official ROS 2 driver for Universal Robots CB3 and e-Series arms, including controller communication and bringup packages.",
      "hardware": [
        "Universal Robots CB3",
        "Universal Robots e-Series"
      ],
      "ros2_native": true,
      "source_status": "official",
      "review_status": "curated",
      "license": "BSD-3-Clause",
      "last_checked": "2026-06-02",
      "notes": "Verify exact PolyScope, external-control, and ROS distro support upstream before deployment.",
      "evidence": [
        {
          "type": "repository",
          "url": "https://github.com/UniversalRobots/Universal_Robots_ROS2_Driver"
        },
        {
          "type": "readme",
          "url": "https://github.com/UniversalRobots/Universal_Robots_ROS2_Driver/blob/main/README.md"
        },
        {
          "type": "license",
          "url": "https://github.com/UniversalRobots/Universal_Robots_ROS2_Driver/blob/main/LICENSE"
        },
        {
          "type": "manifest",
          "url": "https://github.com/UniversalRobots/Universal_Robots_ROS2_Driver/blob/main/ur_controllers/package.xml"
        },
        {
          "type": "manifest",
          "url": "https://github.com/UniversalRobots/Universal_Robots_ROS2_Driver/blob/main/ur_dashboard_msgs/package.xml"
        },
        {
          "type": "manifest",
          "url": "https://github.com/UniversalRobots/Universal_Robots_ROS2_Driver/blob/main/ur_robot_driver/package.xml"
        }
      ]
    },
    {
      "name": "Franka ROS 2",
      "repo": "frankarobotics/franka_ros2",
      "url": "https://github.com/frankarobotics/franka_ros2",
      "category": "industrial-manipulators",
      "description": "ROS 2 integration packages for Franka research robots.",
      "hardware": [
        "Franka research robots"
      ],
      "ros2_native": true,
      "source_status": "official",
      "review_status": "curated",
      "license": "Apache-2.0",
      "last_checked": "2026-06-02",
      "notes": "Confirm exact arm generation, libfranka version, and supported ROS distro upstream.",
      "evidence": [
        {
          "type": "repository",
          "url": "https://github.com/frankarobotics/franka_ros2"
        },
        {
          "type": "readme",
          "url": "https://github.com/frankarobotics/franka_ros2/blob/humble/README.md"
        },
        {
          "type": "license",
          "url": "https://github.com/frankarobotics/franka_ros2/blob/humble/LICENSE"
        },
        {
          "type": "manifest",
          "url": "https://github.com/frankarobotics/franka_ros2/blob/humble/franka_bringup/package.xml"
        },
        {
          "type": "manifest",
          "url": "https://github.com/frankarobotics/franka_ros2/blob/humble/franka_example_controllers/package.xml"
        },
        {
          "type": "manifest",
          "url": "https://github.com/frankarobotics/franka_ros2/blob/humble/franka_gazebo/franka_gazebo_bringup/package.xml"
        }
      ]
    },
    {
      "name": "FANUC ROS 2 Driver",
      "repo": "FANUC-CORPORATION/fanuc_driver",
      "url": "https://github.com/FANUC-CORPORATION/fanuc_driver",
      "category": "industrial-manipulators",
      "description": "FANUC-maintained ROS 2 driver project for FANUC robot controllers.",
      "hardware": [
        "FANUC robots"
      ],
      "ros2_native": true,
      "source_status": "official",
      "review_status": "curated",
      "license": "Apache-2.0",
      "last_checked": "2026-06-02",
      "notes": "Package manifests expose Apache-2.0; confirm controller options, supported robot models, and ROS distro support upstream.",
      "evidence": [
        {
          "type": "repository",
          "url": "https://github.com/FANUC-CORPORATION/fanuc_driver"
        },
        {
          "type": "readme",
          "url": "https://github.com/FANUC-CORPORATION/fanuc_driver/blob/main/README.md"
        },
        {
          "type": "manifest",
          "url": "https://github.com/FANUC-CORPORATION/fanuc_driver/blob/main/fanuc_controllers/package.xml"
        },
        {
          "type": "manifest",
          "url": "https://github.com/FANUC-CORPORATION/fanuc_driver/blob/main/fanuc_hardware_interface/package.xml"
        },
        {
          "type": "manifest",
          "url": "https://github.com/FANUC-CORPORATION/fanuc_driver/blob/main/fanuc_msgs/package.xml"
        }
      ]
    },
    {
      "name": "Kinova ROS 2 Kortex",
      "repo": "Kinovarobotics/ros2_kortex",
      "url": "https://github.com/Kinovarobotics/ros2_kortex",
      "category": "industrial-manipulators",
      "description": "ROS 2 driver packages for Kinova Gen3 arms using the Kortex API.",
      "hardware": [
        "Kinova Gen3"
      ],
      "ros2_native": true,
      "source_status": "official",
      "review_status": "curated",
      "license": "BSD-3-Clause",
      "last_checked": "2026-06-02",
      "notes": "Repository license and package manifests indicate BSD/BSD-3-Clause licensing; confirm firmware, API version, and supported distros upstream.",
      "evidence": [
        {
          "type": "repository",
          "url": "https://github.com/Kinovarobotics/ros2_kortex"
        },
        {
          "type": "readme",
          "url": "https://github.com/Kinovarobotics/ros2_kortex/blob/main/README.md"
        },
        {
          "type": "license",
          "url": "https://github.com/Kinovarobotics/ros2_kortex/blob/main/LICENSE"
        },
        {
          "type": "manifest",
          "url": "https://github.com/Kinovarobotics/ros2_kortex/blob/main/kortex_bringup/package.xml"
        },
        {
          "type": "manifest",
          "url": "https://github.com/Kinovarobotics/ros2_kortex/blob/main/kortex_driver/package.xml"
        },
        {
          "type": "manifest",
          "url": "https://github.com/Kinovarobotics/ros2_kortex/blob/main/kortex_api/package.xml"
        }
      ]
    },
    {
      "name": "xArm ROS 2",
      "repo": "xArm-Developer/xarm_ros2",
      "url": "https://github.com/xArm-Developer/xarm_ros2",
      "category": "industrial-manipulators",
      "description": "ROS 2 packages for UFACTORY xArm robot arms.",
      "hardware": [
        "UFACTORY xArm"
      ],
      "ros2_native": true,
      "source_status": "official",
      "review_status": "curated",
      "license": "BSD-3-Clause",
      "last_checked": "2026-06-02",
      "notes": "Confirm model coverage, controller firmware, and branch/distro mapping upstream.",
      "evidence": [
        {
          "type": "repository",
          "url": "https://github.com/xArm-Developer/xarm_ros2"
        },
        {
          "type": "readme",
          "url": "https://github.com/xArm-Developer/xarm_ros2/blob/humble/ReadMe.md"
        },
        {
          "type": "license",
          "url": "https://github.com/xArm-Developer/xarm_ros2/blob/humble/LICENSE"
        },
        {
          "type": "manifest",
          "url": "https://github.com/xArm-Developer/xarm_ros2/blob/humble/xarm_controller/package.xml"
        },
        {
          "type": "manifest",
          "url": "https://github.com/xArm-Developer/xarm_ros2/blob/humble/xarm_msgs/package.xml"
        },
        {
          "type": "manifest",
          "url": "https://github.com/xArm-Developer/xarm_ros2/blob/humble/demo/mbot_demo/package.xml"
        }
      ]
    },
    {
      "name": "Doosan Robot 2",
      "repo": "DoosanRobotics/doosan-robot2",
      "url": "https://github.com/DoosanRobotics/doosan-robot2",
      "category": "industrial-manipulators",
      "description": "ROS 2 packages for Doosan robot arms.",
      "hardware": [
        "Doosan robots"
      ],
      "ros2_native": true,
      "source_status": "official",
      "review_status": "curated",
      "license": "BSD-3-Clause",
      "last_checked": "2026-06-02",
      "notes": "Confirm controller software requirements and model coverage upstream.",
      "evidence": [
        {
          "type": "repository",
          "url": "https://github.com/DoosanRobotics/doosan-robot2"